{
  "$schema": "../schema/locale.schema.json",
  "locale": "ja",
  "ui": {
    "title": "MHGU Overlay",
    "notRunning": "MHGU 1.4.0 が起動していません",
    "noMonsters": "大型モンスターがいません",
    "size": "サイズ",
    "language": "言語",
    "automatic": "自動",
    "sizePreset": "サイズ固定",
    "off": "オフ",
    "on": "オン",
    "mini": "小冠",
    "silver": "銀冠",
    "gold": "金冠",
    "scan": "再スキャン",
    "scanning": "モンスターデータ待機中",
    "ready": "準備完了",
    "unsupported": "未対応のゲームバージョン",
    "writeFailed": "メモリの書き込みに失敗",
    "hyper": "獰猛",
    "frameRate": "フレームレート",
    "fps30": "30 FPS",
    "fps60": "60 FPS",
    "mapAndLargeMonsters": "マップ・大型位置",
    "carryItemsIntoPouch": "運搬品をポーチへ",
    "hunter": "ハンター",
    "invincible": "無敵",
    "healthNoDecrease": "体力減少なし",
    "staminaNoDecrease": "スタミナ減少なし",
    "sharpnessNoDecrease": "斬れ味減少なし",
    "unlockHunterArtSlots": "狩技スロット解放",
    "unlimitedHunterArts": "狩技無限使用",
    "valorGaugeNoDecrease": "ブレイヴ減少なし",
    "alchemyGaugeFull": "錬金ゲージ満タン",
    "spStatusNoExpire": "SP状態無期限",
    "bowgunAutoReload": "ボウガン自動装填",
    "consumableItemsNoDecrease": "アイテム無限",
    "transmog": "装備重ね着",
    "weaponTransmog": "武器重ね着",
    "armorTransmog": "防具重ね着",
    "palico": "オトモアイルー",
    "palicoHealthNoDecrease": "オトモ体力維持",
    "palicoAffinity": "会心率",
    "hunterAffinity": "会心率",
    "spLevel": "SPレベル",
    "longSwordSpiritGauge": "太刀練気ゲージ",
    "combatParameters": "戦闘パラメータ",
    "monsterDamageMode": "ダメージ設定",
    "instantKill": "一撃必殺",
    "leaveOneHp": "体力1残し",
    "attackMultiplier": "攻撃",
    "defenseMultiplier": "防御",
    "movementSpeedMultiplier": "移動速度",
    "quest": "クエスト",
    "infiniteQuestTime": "時間無限",
    "unlimitedFaints": "力尽き無制限",
    "completeQuest": "クエスト完了",
    "execute": "実行",
    "completed": "完了",
    "noActiveQuest": "クエスト未進行",
    "failed": "失敗",
    "resources": "資源",
    "zenny": "ゼニー",
    "wycademyPoints": "龍歴院P",
    "itemPouchSlot": "ポーチ枠",
    "itemPouchQuantity": "個数",
    "applyItemPouchQuantity": "個数を適用",
    "monsterInfoOverlay": "モンスターHUD",
    "hudLayout": "HUDレイアウト",
    "hudBottomLeftVertical": "左下・縦",
    "hudTopRightVertical": "右上・縦",
    "hudTopCenterHorizontal": "上中央・横",
    "hudCenterLeftVertical": "左中央・縦",
    "hudCenterRightVertical": "右中央・縦",
    "hudContent": "HUD表示内容",
    "hudMonsterInfo": "モンスター情報",
    "hudMonsterInfoAndDamage": "モンスター情報＋ダメージ",
    "hudDamageOnly": "ダメージのみ",
    "foodSkills": "食事スキル変更",
    "foodSkill1": "食事スキル 1",
    "foodSkill2": "食事スキル 2",
    "foodSkill3": "食事スキル 3",
    "applyFoodSkills": "食事スキルを適用",
    "noCharacterData": "キャラデータなし"
  },
  "foodSkills": {
    "felyne-carver-hi": "ネコの解体術〖大〗",
    "felyne-carver-lo": "ネコの解体術〖小〗",
    "felyne-medic": "ネコの医療術",
    "felyne-black-belt": "ネコの体術",
    "felyne-pyro": "ネコの火薬術",
    "felyne-specialist": "ネコの特殊攻撃術",
    "felyne-defender-hi": "ネコの防御術〖大〗",
    "felyne-defender-lo": "ネコの防御術〖小〗",
    "felyne-hornblower": "ネコの吹奏術",
    "felyne-woodsman": "ネコの道具倹約術",
    "felyne-charisma": "ネコのカリスマ",
    "felyne-combiner-hi": "ネコの調合術〖大〗",
    "felyne-combiner-lo": "ネコの調合術〖小〗",
    "felyne-gatherer": "ネコの採取術",
    "felyne-sharpshooter": "ネコの射撃術",
    "ultra-lucky-cat": "招きネコの激運",
    "lucky-cat": "招きネコの幸運",
    "felyne-heroics": "ネコの火事場力",
    "felyne-deflector": "ネコのはじかれ上手",
    "felyne-escape-artist": "ネコの逃走術",
    "felyne-hurler": "ネコの投擲術",
    "felyne-courage": "ネコの胆力",
    "felyne-supercat": "ネコの運搬の超人",
    "felyne-strongcat": "ネコの運搬の鉄人",
    "felyne-weakener": "ネコの弱いの来い！",
    "felyne-explorer": "ネコの秘境探索術",
    "felyne-exchanger": "ネコの換算術",
    "felyne-riser-hi": "ネコの起上り術〖大〗",
    "felyne-riser-lo": "ネコの起上り術〖小〗",
    "felyne-temper": "ネコの暴れ撃ち",
    "felyne-kickboxer": "ネコの蹴脚術",
    "felyne-fighter": "ネコの拳闘術",
    "felyne-cliffhanger": "ネコのはりつき超人",
    "felyne-gripper": "ネコのはりつき鉄人",
    "felyne-supercarver": "ネコの解体の鉄人",
    "felyne-lander": "ネコの着地術",
    "cool-cat": "ネコの休憩術",
    "felyne-bulldozer": "ネコのゴリ押し術",
    "felyne-foodie": "ネコのおまけ術",
    "felyne-slugger": "ネコのＫＯ術",
    "crazy-lucky-cat": "招きネコの金運",
    "felyne-bombardier": "ネコの砲撃術",
    "felyne-moxie": "ネコのド根性",
    "felyne-dungmaster": "ネコのこやし玉達人",
    "felyne-groomer": "ネコの毛づくろい上手",
    "felyne-fur-coating": "ネコの長靴術",
    "felyne-slider": "ネコのすり抜け術",
    "felyne-oracle": "ネコの千里眼の術",
    "felyne-polisher": "ネコの研磨術",
    "felyne-acrobat": "ネコの受け身術",
    "felyne-gamechanger": "ネコのかかってこい",
    "felyne-trainer": "ネコのオトモ指導術",
    "felyne-booster": "ネコの短期催眠術",
    "felyne-supplier": "ネコの手配上手",
    "felyne-insomniac": "ネコの不眠術",
    "felyne-feet": "ネコのふんばり術",
    "felyne-fisher": "ネコの釣り上手",
    "unlucky-cat": "招きネコの悪運",
    "felyne-rider": "ネコの乗り上手",
    "felyne-hostler": "ネコの乗り支援術",
    "felyne-insurance": "ネコの報酬金保険",
    "felyne-provoker": "ネコの憎まれ上手",
    "felyne-accountant": "ネコの会計術",
    "felyne-bequest": "ネコのあとは任せた！",
    "jinxed-cat": "招きネコの不運"
  },
  "monsters": {
    "great-maccao": "ドスマッカォ",
    "velocidrome": "ドスランポス",
    "bulldrome": "ドスファンゴ",
    "seltas": "アルセルタス",
    "seltas-queen": "ゲネル・セルタス",
    "arzuros": "アオアシラ",
    "redhelm-arzuros": "紅兜アオアシラ",
    "giadrome": "ドスギアノス",
    "gendrome": "ドスゲネポス",
    "cephadrome": "ドスガレオス",
    "yian-kut-ku": "イャンクック",
    "iodrome": "ドスイーオス",
    "kecha-wacha": "ケチャワチャ",
    "lagombi": "ウルクスス",
    "snowbaron-lagombi": "大雪主ウルクスス",
    "gypceros": "ゲリョス",
    "tetsucabra": "テツカブラ",
    "drilltusk-tetsucabra": "岩穿テツカブラ",
    "daimyo-hermitaur": "ダイミョウザザミ",
    "stonefist-hermitaur": "矛砕ダイミョウザザミ",
    "volvidon": "ラングロトラ",
    "congalala": "ババコンガ",
    "royal-ludroth": "ロアルドロス",
    "barroth": "ボルボロス",
    "basarios": "バサルモス",
    "malfestio": "ホロロホルル",
    "nightcloak-malfestio": "朧隠ホロロホルル",
    "zamtrios": "ザボアザギル",
    "khezu": "フルフル",
    "nerscylla": "ネルスキュラ",
    "rathian": "リオレイア",
    "gold-rathian": "リオレイア希少種",
    "dreadqueen-rathian": "紫毒姫リオレイア",
    "rathalos": "リオレウス",
    "silver-rathalos": "リオレウス希少種",
    "dreadking-rathalos": "黒炎王リオレウス",
    "nibelsnarf": "ハプルボッカ",
    "plesioth": "ガノトトス",
    "blangonga": "ドドブランゴ",
    "lavasioth": "ヴォルガノス",
    "shogun-ceanataur": "ショウグンギザミ",
    "rustrazor-ceanataur": "鎧裂ショウグンギザミ",
    "najarala": "ガララアジャラ",
    "nargacuga": "ナルガクルガ",
    "silverwind-nargacuga": "白疾風ナルガクルガ",
    "yian-garuga": "イャンガルルガ",
    "deadeye-yian-garuga": "隻眼イャンガルルガ",
    "uragaan": "ウラガンキン",
    "crystalbeard-uragaan": "宝纏ウラガンキン",
    "lagiacrus": "ラギアクルス",
    "zinogre": "ジンオウガ",
    "thunderlord-zinogre": "金雷公ジンオウガ",
    "barioth": "ベリオロス",
    "mizutsune": "タマミツネ",
    "soulseer-mizutsune": "天眼タマミツネ",
    "astalos": "ライゼクス",
    "boltreaver-astalos": "青電主ライゼクス",
    "gammoth": "ガムート",
    "elderfrost-gammoth": "銀嶺ガムート",
    "glavenus": "ディノバルド",
    "hellblade-glavenus": "燼滅刃ディノバルド",
    "agnaktor": "アグナコトル",
    "gore-magala": "ゴア・マガラ",
    "chaotic-gore-magala": "渾沌に呻くゴア・マガラ",
    "seregios": "セルレギオス",
    "duramboros": "ドボルベルク",
    "tigrex": "ティガレックス",
    "grimclaw-tigrex": "荒鉤爪ティガレックス",
    "gravios": "グラビモス",
    "diablos": "ディアブロス",
    "bloodbath-diablos": "鏖魔ディアブロス",
    "kirin": "キリン",
    "brachydios": "ブラキディオス",
    "raging-brachydios": "猛り爆ぜるブラキディオス",
    "shagaru-magala": "シャガルマガラ",
    "valstrax": "バルファルク",
    "rajang": "ラージャン",
    "furious-rajang": "激昂したラージャン",
    "deviljho": "イビルジョー",
    "savage-deviljho": "怒り喰らうイビルジョー",
    "kushala-daora": "クシャルダオラ",
    "chameleos": "オオナズチ",
    "teostra": "テオ・テスカトル",
    "lao-shan-lung": "ラオシャンロン",
    "akantor": "アカムトルム",
    "ukanlos": "ウカムルバス",
    "amatsu": "アマツマガツチ",
    "nakarkos": "オストガロア",
    "ahtal-throne": "アトラル・ネセト",
    "ahtal-ka": "アトラル・カ",
    "alatreon": "アルバトリオン",
    "fatalis": "ミラボレアス",
    "crimson-fatalis": "ミラボレアス【紅龍】",
    "white-fatalis": "ミラボレアス【祖龍】"
  }
}
