{
  "$schema": "../schema/locale.schema.json",
  "locale": "zh-Hans",
  "ui": {
    "title": "MHGU Overlay",
    "notRunning": "未检测到 MHGU 1.4.0",
    "noMonsters": "未发现大型怪物",
    "size": "体型",
    "language": "语言",
    "automatic": "自动",
    "sizePreset": "体型锁定",
    "off": "关闭",
    "on": "开启",
    "mini": "小金冠",
    "silver": "大银冠",
    "gold": "大金冠",
    "scan": "重新扫描",
    "scanning": "等待怪物数据",
    "ready": "已就绪",
    "unsupported": "不支持的游戏版本",
    "writeFailed": "内存写入失败",
    "hyper": "狞猛",
    "frameRate": "帧率",
    "fps30": "30 FPS",
    "fps60": "60 FPS",
    "mapAndLargeMonsters": "地图与怪物标记",
    "carryItemsIntoPouch": "搬运品进道具袋",
    "hunter": "猎人",
    "invincible": "无敌",
    "healthNoDecrease": "体力不减",
    "staminaNoDecrease": "耐力不减",
    "sharpnessNoDecrease": "斩味不减",
    "unlockHunterArtSlots": "解锁狩技槽",
    "unlimitedHunterArts": "狩技无限使用",
    "valorGaugeNoDecrease": "勇气槽不减",
    "alchemyGaugeFull": "炼金槽全满",
    "spStatusNoExpire": "SP状态不消失",
    "bowgunAutoReload": "弩炮自动装填",
    "consumableItemsNoDecrease": "道具不减",
    "transmog": "装备幻化",
    "weaponTransmog": "武器幻化",
    "armorTransmog": "防具幻化",
    "palico": "随从艾露猫",
    "palicoHealthNoDecrease": "随从体力不减",
    "palicoAffinity": "会心率",
    "hunterAffinity": "会心率",
    "spLevel": "SP等级",
    "longSwordSpiritGauge": "太刀练气槽",
    "combatParameters": "战斗参数",
    "monsterDamageMode": "伤害模式",
    "instantKill": "一击必杀",
    "leaveOneHp": "保留1点体力",
    "attackMultiplier": "攻击",
    "defenseMultiplier": "防御",
    "movementSpeedMultiplier": "移动速度",
    "quest": "任务",
    "infiniteQuestTime": "无限任务时间",
    "unlimitedFaints": "无限死亡次数",
    "completeQuest": "完成当前任务",
    "execute": "执行",
    "completed": "已完成",
    "noActiveQuest": "无进行中任务",
    "failed": "失败",
    "resources": "资源",
    "zenny": "金钱",
    "wycademyPoints": "龙历院点",
    "itemPouchSlot": "道具袋格位",
    "itemPouchQuantity": "数量",
    "applyItemPouchQuantity": "应用数量",
    "monsterInfoOverlay": "怪物 HUD",
    "hudLayout": "HUD 布局",
    "hudBottomLeftVertical": "左下纵向",
    "hudTopRightVertical": "右上纵向",
    "hudTopCenterHorizontal": "顶部居中横向",
    "hudCenterLeftVertical": "左侧居中纵向",
    "hudCenterRightVertical": "右侧居中纵向",
    "hudContent": "HUD 显示内容",
    "hudMonsterInfo": "怪物信息",
    "hudMonsterInfoAndDamage": "怪物信息 + 伤害",
    "hudDamageOnly": "仅伤害数字",
    "foodSkills": "猫饭自定义",
    "foodSkill1": "猫饭技能 1",
    "foodSkill2": "猫饭技能 2",
    "foodSkill3": "猫饭技能 3",
    "applyFoodSkills": "应用猫饭技能",
    "noCharacterData": "角色数据不可用"
  },
  "foodSkills": {
    "felyne-carver-hi": "猫的解体术〖大〗",
    "felyne-carver-lo": "猫的解体术〖小〗",
    "felyne-medic": "猫的医疗术",
    "felyne-black-belt": "猫的体术",
    "felyne-pyro": "猫的火药术",
    "felyne-specialist": "猫的特殊攻击术",
    "felyne-defender-hi": "猫的防御术〖大〗",
    "felyne-defender-lo": "猫的防御术〖小〗",
    "felyne-hornblower": "猫的吹奏术",
    "felyne-woodsman": "猫的道具节约术",
    "felyne-charisma": "猫的诱惑术",
    "felyne-combiner-hi": "猫的调和术(大)",
    "felyne-combiner-lo": "猫的调和术(小)",
    "felyne-gatherer": "猫的采集术",
    "felyne-sharpshooter": "猫的射击术",
    "ultra-lucky-cat": "招财猫的激运",
    "lucky-cat": "招财猫的幸运",
    "felyne-heroics": "猫的火场怪力",
    "felyne-deflector": "猫的弹武好手",
    "felyne-escape-artist": "猫的逃走术",
    "felyne-hurler": "猫的投掷术",
    "felyne-courage": "猫的胆力",
    "felyne-supercat": "猫的搬运超人",
    "felyne-strongcat": "猫的搬运铁人",
    "felyne-weakener": "猫的弱小招来！",
    "felyne-explorer": "猫的秘境探索术",
    "felyne-exchanger": "猫的换算术",
    "felyne-riser-hi": "猫的起身术〖大〗",
    "felyne-riser-lo": "猫的起身术〖小〗",
    "felyne-temper": "猫的粗暴射击",
    "felyne-kickboxer": "猫的踢脚术",
    "felyne-fighter": "猫的拳斗术",
    "felyne-cliffhanger": "猫的攀壁超人",
    "felyne-gripper": "猫的紧抓不放铁人",
    "felyne-supercarver": "猫的解体铁人",
    "felyne-lander": "猫的着地术",
    "cool-cat": "猫的休息术",
    "felyne-bulldozer": "猫的蛮干术",
    "felyne-foodie": "猫的赠品术",
    "felyne-slugger": "猫的击晕术",
    "crazy-lucky-cat": "招财猫的财运",
    "felyne-bombardier": "猫的炮击术",
    "felyne-moxie": "猫的大毅力",
    "felyne-dungmaster": "猫的异臭球达人",
    "felyne-groomer": "猫的理毛好手",
    "felyne-fur-coating": "猫的长靴术",
    "felyne-slider": "猫的穿越术",
    "felyne-oracle": "猫的千里眼术",
    "felyne-polisher": "猫的研磨术",
    "felyne-acrobat": "猫的受身术",
    "felyne-gamechanger": "猫的强者挑战术",
    "felyne-trainer": "猫的随从指导术",
    "felyne-booster": "猫的短期催眠术",
    "felyne-supplier": "猫的宅配术",
    "felyne-insomniac": "猫的不眠术",
    "felyne-feet": "猫的坚定不移术",
    "felyne-fisher": "猫的钓鱼好手",
    "unlucky-cat": "招财猫的恶运",
    "felyne-rider": "猫的骑乘好手",
    "felyne-hostler": "猫的骑乘支援术",
    "felyne-insurance": "猫的报酬金保险",
    "felyne-provoker": "猫的吸引仇恨好手",
    "felyne-accountant": "猫的会计术",
    "felyne-bequest": "猫的后面交给你们了！",
    "jinxed-cat": "招财猫的不幸"
  },
  "monsters": {
    "great-maccao": "跳狗龙王",
    "velocidrome": "蓝速龙王",
    "bulldrome": "大野猪王",
    "seltas": "彻甲虫",
    "seltas-queen": "重甲虫",
    "arzuros": "青熊兽",
    "redhelm-arzuros": "红兜青熊兽",
    "giadrome": "白速龙王",
    "gendrome": "黄速龙王",
    "cephadrome": "砂龙王",
    "yian-kut-ku": "怪鸟",
    "iodrome": "红速龙王",
    "kecha-wacha": "奇猿狐",
    "lagombi": "白兔兽",
    "snowbaron-lagombi": "大雪主白兔兽",
    "gypceros": "毒怪鸟",
    "tetsucabra": "鬼蛙",
    "drilltusk-tetsucabra": "岩穿鬼蛙",
    "daimyo-hermitaur": "大名盾蟹",
    "stonefist-hermitaur": "矛碎大名盾蟹",
    "volvidon": "赤甲兽",
    "congalala": "桃毛兽王",
    "royal-ludroth": "水兽",
    "barroth": "土砂龙",
    "basarios": "岩龙",
    "malfestio": "夜鸟",
    "nightcloak-malfestio": "胧隐夜鸟",
    "zamtrios": "化鲛",
    "khezu": "奇怪龙",
    "nerscylla": "影蜘蛛",
    "rathian": "雌火龙",
    "gold-rathian": "金火龙",
    "dreadqueen-rathian": "紫毒姬雌火龙",
    "rathalos": "火龙",
    "silver-rathalos": "银火龙",
    "dreadking-rathalos": "黑炎王火龙",
    "nibelsnarf": "潜口龙",
    "plesioth": "水龙",
    "blangonga": "雪狮子王",
    "lavasioth": "熔岩龙",
    "shogun-ceanataur": "将军镰蟹",
    "rustrazor-ceanataur": "铠裂将军镰蟹",
    "najarala": "绞蛇龙",
    "nargacuga": "迅龙",
    "silverwind-nargacuga": "白疾风迅龙",
    "yian-garuga": "黑狼鸟",
    "deadeye-yian-garuga": "独眼黑狼鸟",
    "uragaan": "爆锤龙",
    "crystalbeard-uragaan": "宝缠爆锤龙",
    "lagiacrus": "海龙",
    "zinogre": "雷狼龙",
    "thunderlord-zinogre": "金雷公雷狼龙",
    "barioth": "冰牙龙",
    "mizutsune": "泡狐龙",
    "soulseer-mizutsune": "天眼泡狐龙",
    "astalos": "电龙",
    "boltreaver-astalos": "青电主电龙",
    "gammoth": "巨兽",
    "elderfrost-gammoth": "银岭巨兽",
    "glavenus": "斩龙",
    "hellblade-glavenus": "烬灭刃斩龙",
    "agnaktor": "炎戈龙",
    "gore-magala": "黑蚀龙",
    "chaotic-gore-magala": "混沌黑蚀龙",
    "seregios": "千刃龙",
    "duramboros": "尾锤龙",
    "tigrex": "轰龙",
    "grimclaw-tigrex": "荒钩爪轰龙",
    "gravios": "铠龙",
    "diablos": "角龙",
    "bloodbath-diablos": "鏖魔角龙",
    "kirin": "麒麟",
    "brachydios": "碎龙",
    "raging-brachydios": "猛爆碎龙",
    "shagaru-magala": "天廻龙",
    "valstrax": "天彗龙",
    "rajang": "金狮子",
    "furious-rajang": "激昂金狮子",
    "deviljho": "恐暴龙",
    "savage-deviljho": "怒食恐暴龙",
    "kushala-daora": "钢龙",
    "chameleos": "霞龙",
    "teostra": "炎王龙",
    "lao-shan-lung": "老山龙",
    "akantor": "霸龙",
    "ukanlos": "崩龙",
    "amatsu": "岚龙",
    "nakarkos": "骸龙",
    "ahtal-throne": "阁螳螂机甲",
    "ahtal-ka": "阁螳螂",
    "alatreon": "煌黑龙",
    "fatalis": "黑龙",
    "crimson-fatalis": "红黑龙",
    "white-fatalis": "祖龙"
  }
}
